{
  "schema_version": 1,
  "generated_at": "2026-10-13T04:03:53.603Z",
  "edge_count": 0,
  "advertisement_count": 1,
  "advertisements": [
    {
      "origin": "https://joshternet.org",
      "blogroll": "https://joshternet.org/assets/network/joshternet.opml",
      "source_authority": "joshternet-generated",
      "relationship_evidence": false,
      "reason": "Hub-generated OPML is a subscription file, not independent blogroll evidence."
    }
  ]
}
